{
  "$schema": "https://json-schema.org/draft/2020-12/schema",
  "$id": "https://proofpath.dev/schemas/payment-action-context.schema.json",
  "title": "ProofPath Payment Action Context",
  "type": "object",
  "required": ["action_type", "asset", "amount", "recipient", "purpose", "agent_id", "payment_mode"],
  "properties": {
    "action_type": {"const": "agent_payment"},
    "asset": {"type": "string"},
    "amount": {"type": "string", "pattern": "^[0-9]+(\\.[0-9]+)?$"},
    "recipient": {"type": "string", "minLength": 1},
    "approved_recipient": {"type": "string"},
    "purpose": {"type": "string"},
    "agent_id": {"type": "string"},
    "human_intent_id": {"type": "string"},
    "causal_parent": {"type": "string"},
    "budget_scope": {"type": "string"},
    "approved_budget": {"type": "string", "pattern": "^[0-9]+(\\.[0-9]+)?$"},
    "payment_mode": {"enum": ["one_time", "recurring"]},
    "recurring_approval": {"type": ["boolean", "string"]}
  },
  "additionalProperties": true
}
