{
  "action_type": "agent_payment",
  "asset": "USDC",
  "amount": "0.07",
  "recipient": "market-data-api.example",
  "approved_recipient": "market-data-api.example",
  "purpose": "",
  "agent_id": "agent_researcher_01",
  "budget_scope": "daily_research_budget",
  "approved_budget": "5.00",
  "payment_mode": "one_time"
}
